{"$id":"https://aluclu.org/schemas/alc_r0/v1/lock-manifest.schema.json","$schema":"https://json-schema.org/draft/2020-12/schema","additionalProperties":false,"properties":{"creation_source_commit":{"pattern":"^[0-9a-f]{40}$","type":"string"},"experiment_id":{"const":"alc-r0-smollm2-135m-v1"},"locks":{"items":false,"maxItems":2,"minItems":2,"prefixItems":[{"additionalProperties":false,"properties":{"byte_length":{"minimum":1,"type":"integer"},"input_sha256":{"pattern":"^[0-9a-f]{64}$","type":"string"},"platform":{"const":"x86_64-pc-windows-msvc"},"python_implementation":{"const":"CPython"},"python_version":{"const":"3.12.13"},"relative_path":{"const":"locks/alc_r0/v1/windows-training.lock"},"role":{"const":"windows-training"},"sha256":{"pattern":"^[0-9a-f]{64}$","type":"string"},"status":{"const":"generated"}},"required":["byte_length","input_sha256","platform","python_implementation","python_version","relative_path","role","sha256","status"],"type":"object"},{"additionalProperties":false,"properties":{"byte_length":{"minimum":1,"type":"integer"},"input_sha256":{"pattern":"^[0-9a-f]{64}$","type":"string"},"platform":{"const":"x86_64-manylinux_2_28"},"python_implementation":{"const":"CPython"},"python_version":{"const":"3.12"},"relative_path":{"const":"locks/alc_r0/v1/linux-eval.lock"},"role":{"const":"linux-eval"},"sha256":{"pattern":"^[0-9a-f]{64}$","type":"string"},"status":{"enum":["provisional-until-rootfs-reproduced","reproduced"]}},"required":["byte_length","input_sha256","platform","python_implementation","python_version","relative_path","role","sha256","status"],"type":"object"}],"type":"array"},"resolver":{"additionalProperties":false,"properties":{"name":{"const":"uv"},"version":{"const":"0.12.5"}},"required":["name","version"],"type":"object"},"schema_id":{"const":"https://aluclu.org/schemas/alc_r0/v1/lock-manifest.schema.json"},"schema_version":{"const":1}},"required":["creation_source_commit","experiment_id","locks","resolver","schema_id","schema_version"],"title":"ALC-R0 v1 dependency lock manifest","type":"object"}