{"creation_source_commit":"917387ee75d37b1fb46f4d0192ef0e4b64a24693","experiment_id":"alc-r0-smollm2-135m-v1","locks":[{"byte_length":73416,"input_sha256":"45beaa397ebafb0f61dd1c88de912ace7b449b57574fa848ae0b0e091b2f458c","platform":"x86_64-pc-windows-msvc","python_implementation":"CPython","python_version":"3.12.13","relative_path":"locks/alc_r0/v1/windows-training.lock","role":"windows-training","sha256":"a7a921f7b095b0329fbb7df6a25612c6e8a1f160122f853a6a159d8478946615","status":"generated"},{"byte_length":80958,"input_sha256":"56add7a92c2921e3ae50721257d61e5484382271616517f86c7a7e5e72223f68","platform":"x86_64-manylinux_2_28","python_implementation":"CPython","python_version":"3.12","relative_path":"locks/alc_r0/v1/linux-eval.lock","role":"linux-eval","sha256":"4b6bb24c97a1accd301856f253957ded0fd3b8fed465c79f2bf37beafb3e1c65","status":"provisional-until-rootfs-reproduced"}],"resolver":{"name":"uv","version":"0.12.5"},"schema_id":"https://aluclu.org/schemas/alc_r0/v1/lock-manifest.schema.json","schema_version":1}